{
  "projectId": "project-example",
  "projectVersion": 1,
  "payload": {
    "confidence": {
      "version": 1
    },
    "spokenText": {
      "version": 1
    },
    "semanticText": {
      "version": 1
    },
    "subtitleText": {
      "version": 1
    }
  },
  "status": "READY",
  "warnings": [],
  "trace": {
    "skill": "21-dialect-render",
    "skillVersion": "1.0.0"
  }
}
